{
  "act1": {
    "weapons": [
      "Hand Axe",
      "Javelin",
      "Steel Sword",
      "Steel Lance",
      "Steel Axe",
      "Steel Bow",
      "Wildfire",
      "Brilliance",
      "Mend",
      "Horsebane",
      "Mailbane",
      "Lancehook",
      "Axehook",
      "Bladehook",
      "Gust Blade",
      "Shortbow"
    ],
    "healing": [
      "Vulnerary",
      "Vulnerary",
      "Vulnerary",
      "Vulnerary"
    ],
    "statBooster": [],
    "promotion": [
      "Master Seal"
    ],
    "skillScroll": [],
    "weaponArtScroll": ["Grounder Scroll", "Helm Splitter Scroll"],
    "artTiers": {
      "innateChance": {"Iron": 0.3, "Steel": 0.1},
      "scrollSlots": {"Iron": 2, "Steel": 0}
    },
    "epicWeapons": ["Prodding Spear", "Parrying Blade", "Rook's Bow", "Pilgrim's Lamp", "Tollkeeper's Knife", "Thornwood Bow"],
    "epicChance": 0.1,
    "legendaryWeapon": [],
    "accessories": [
      "Goddess Icon",
      "Shield Ring",
      "Forest Charm",
      "Soothing Stone",
      "Hunter's Cloak",
      "Gambler's Coin"
    ],
    "forge": [
      "Might Whetstone",
      "Hit Whetstone",
      "Weight Whetstone"
    ],
    "carryPool": [
      { "item": "Vulnerary", "weight": 6 },
      { "item": "Gold Pouch", "weight": 3, "value": 300 }
    ],
    "weights": {
      "weapon": 20,
      "healing": 12,
      "statBooster": 0,
      "promotion": 3,
      "skillScroll": 0,
      "weaponArtScroll": 0,
      "legendaryWeapon": 0,
      "accessory": 15,
      "forge": 15,
      "gold": 35
    },
    "goldRange": [
      360,
      600
    ],
    "bossRewards": {
      "weapons": [
        "Keen Sword",
        "Keen Lance",
        "Keen Axe",
        "Keen Bow",
        "Conflagration",
        "Crownlight"
      ],
      "healing": [],
      "statBooster": [
        "Angelic Robe",
        "Energy Drop",
        "Spirit Dust",
        "Secret Book",
        "Speedwing",
        "Dracoshield",
        "Talisman"
      ],
      "promotion": [
        "Master Seal"
      ],
      "skillScroll": [],
      "weaponArtScroll": [],
      "legendaryWeapon": [],
      "accessories": [
        "Goddess Icon",
        "Shield Ring",
        "Forest Charm",
        "Soothing Stone",
        "Hunter's Cloak",
        "Gambler's Coin"
      ],
      "forge": [
        "Might Whetstone",
        "Hit Whetstone",
        "Weight Whetstone"
      ],
      "weights": {
        "weapon": 25,
        "healing": 0,
        "statBooster": 25,
        "promotion": 10,
        "skillScroll": 0,
        "weaponArtScroll": 0,
        "legendaryWeapon": 0,
        "accessory": 20,
        "forge": 20,
        "gold": 0
      },
      "goldRange": [
        360,
        600
      ]
    }
  },
  "act2": {
    "weapons": [
      "Short Spear",
      "Longbow",
      "Horsebane",
      "Mailbane",
      "Keen Sword",
      "Witchfire",
      "Sunflare",
      "Hammer",
      "Spear",
      "Keen Lance",
      "Physic",
      "Restore",
      "Conflagration",
      "Crownlight",
      "Recurve Bow",
      "Rescue Staff"
    ],
    "healing": [
      "Vulnerary",
      "Elixir",
      "Herb"
    ],
    "statBooster": [
      "Energy Drop",
      "Spirit Dust",
      "Secret Book",
      "Speedwing",
      "Dracoshield",
      "Talisman",
      "Angelic Robe",
      "Swiftsoles"
    ],
    "promotion": [
      "Master Seal",
      "Infantry Seal"
    ],
    "skillScroll": [
      "Sol Scroll",
      "Luna Scroll",
      "Guard Scroll",
      "Cancel Scroll",
      "Desperation Scroll",
      "Rally Cry Scroll",
      "Healing Circle Scroll",
      "Ensnare Scroll",
      "Pass Scroll",
      "Uncanny Blow Scroll",
      "Warding Blow Scroll",
      "Lifetaker Scroll",
      "Speedtaker Scroll",
      "Defiant Scroll"
    ],
    "weaponArtScroll": ["Grounder Scroll", "Helm Splitter Scroll"],
    "artTiers": {
      "innateChance": {"Iron": 0.25, "Steel": 0.2},
      "scrollSlots": {"Iron": 2, "Steel": 11}
    },
    "epicWeapons": ["Prodding Spear", "Parrying Blade", "Rook's Bow", "Pilgrim's Lamp", "Tollkeeper's Knife", "Thornwood Bow", "Haulhook", "Phalanx Pike", "Mirrorglass", "Tallyblade", "Wakelight"],
    "epicChance": 0.15,
    "legendaryWeapon": [],
    "accessories": [
      "Power Ring",
      "Speed Ring",
      "Barrier Ring",
      "Skill Ring",
      "Life Ring",
      "Veteran's Crest",
      "Vanguard Crest",
      "Diamond Medallion",
      "Moontide Amulet",
      "Bounty Hunter's Mark",
      "Vampire's Bloodshard",
      "Boots",
      "Warding Charm",
      "Mentor's Band",
      "Gemini Ring"
    ],
    "forge": [
      "Silver Whetstone",
      "Silver Whetstone",
      "Might Whetstone",
      "Might Whetstone",
      "Crit Whetstone",
      "Crit Whetstone",
      "Hit Whetstone",
      "Hit Whetstone",
      "Weight Whetstone",
      "Weight Whetstone",
      "Prismatic Stone"
    ],
    "carryPool": [
      { "item": "Vulnerary", "weight": 5 },
      { "item": "Gold Pouch", "weight": 3, "value": 300 },
      { "from": "statBooster", "weight": 1 }
    ],
    "weights": {
      "weapon": 20,
      "healing": 3,
      "statBooster": 10,
      "promotion": 2,
      "skillScroll": 4,
      "weaponArtScroll": 6,
      "legendaryWeapon": 0,
      "accessory": 15,
      "forge": 20,
      "gold": 20
    },
    "goldRange": [
      720,
      1080
    ]
  },
  "act3": {
    "weapons": [
      "Silver Sword",
      "Silver Lance",
      "Silver Axe",
      "Silver Bow",
      "Conflagration",
      "Crownlight",
      "Recover",
      "Physic",
      "Restore",
      "Keen Sword",
      "Witchfire",
      "Sunflare",
      "Hammer",
      "Tomahawk",
      "Spear",
      "Keen Lance",
      "Adder Blade",
      "Keen Axe",
      "Keen Bow",
      "Gale Blade",
      "Thunderbrand",
      "Rescue Staff",
      "Warp Staff"
    ],
    "healing": [
      "Elixir",
      "Herb",
      "Remedy"
    ],
    "statBooster": [
      "Energy Drop",
      "Spirit Dust",
      "Secret Book",
      "Speedwing",
      "Dracoshield",
      "Talisman",
      "Angelic Robe",
      "Swiftsoles"
    ],
    "promotion": [
      "Master Seal",
      "Infantry Seal",
      "Mounted Seal"
    ],
    "skillScroll": [
      "Astra Scroll",
      "Vantage Scroll",
      "Wrath Scroll",
      "Adept Scroll",
      "Miracle Scroll",
      "Quick Riposte Scroll",
      "Death Blow Scroll",
      "Darting Blow Scroll",
      "Shove Scroll",
      "Pull Scroll",
      "Smite Scroll",
      "Transfuse Scroll",
      "Great Sacrifice Scroll",
      "Blink Strike Scroll",
      "Pass Scroll",
      "Blink Scroll",
      "Rally Cry Scroll",
      "Healing Circle Scroll",
      "Ensnare Scroll",
      "Uncanny Blow Scroll",
      "Warding Blow Scroll",
      "Lifetaker Scroll",
      "Speedtaker Scroll",
      "Defiant Scroll"
    ],
    "weaponArtScroll": [
      "Grounder Scroll",
      "Helm Splitter Scroll",
      "Dragonhaze Scroll",
      "Longearche Scroll",
      "Glowing Ember Scroll",
      "Armored Strike Scroll",
      "Deadeye Scroll",
      "Hunter's Volley Scroll",
      "Burning Quake Scroll",
      "Nosferatu Scroll",
      "Silence Strike Scroll",
      "Benediction Scroll",
      "Battering Ram Scroll"
    ],
    "artTiers": {
      "innateChance": {"Iron": 0.1, "Steel": 0.25},
      "scrollSlots": {"Iron": 1, "Steel": 8}
    },
    "epicWeapons": ["Tollkeeper's Knife", "Thornwood Bow", "Haulhook", "Phalanx Pike", "Mirrorglass", "Cinderstring", "Tallyblade", "Wakelight", "Gorgemaw", "Hollowsong"],
    "epicChance": 0.15,
    "legendaryWeapon": [
      "Ragnarok",
      "Namethief",
      "Breachbolt",
      "Twinsworn",
      "Doomblade",
      "Gae Bolg",
      "Starfall",
      "Tidebreaker",
      "Ruin",
      "Hermit's Bow",
      "Oathblade",
      "Oathlance",
      "Oathaxe",
      "Oathbow",
      "Firstwind",
      "Endword",
      "Daybreak"
    ],
    "accessories": [
      "Seraph Robe",
      "Magic Ring",
      "Boots",
      "Delphi Shield",
      "Wrath Band",
      "Counter Seal",
      "Pursuit Ring",
      "Blood Gem",
      "Recoil Guard",
      "Phoenix Brooch",
      "Duelist's Glove",
      "Warding Charm",
      "Mentor's Band",
      "Mercury Sandals",
      "Phalanx Band",
      "Gemini Ring",
      "Warden's Buckler"
    ],
    "forge": [
      "Silver Whetstone",
      "Silver Whetstone",
      "Might Whetstone",
      "Might Whetstone",
      "Crit Whetstone",
      "Crit Whetstone",
      "Hit Whetstone",
      "Hit Whetstone",
      "Weight Whetstone",
      "Weight Whetstone",
      "Prismatic Stone",
      "Vampiric Imbuing Stone",
      "Cruel Imbuing Stone"
    ],
    "carryPool": [
      { "item": "Vulnerary", "weight": 3 },
      { "item": "Elixir", "weight": 3 },
      { "item": "Gold Pouch", "weight": 3, "value": 500 },
      { "from": "statBooster", "weight": 1 }
    ],
    "weights": {
      "weapon": 25,
      "healing": 2,
      "statBooster": 11,
      "promotion": 2,
      "skillScroll": 5,
      "weaponArtScroll": 5,
      "legendaryWeapon": 7,
      "accessory": 15,
      "forge": 15,
      "gold": 15
    },
    "goldRange": [
      1100,
      1700
    ]
  },
  "act4": {
    "weapons": [
      "Silver Sword",
      "Silver Lance",
      "Silver Axe",
      "Silver Bow",
      "Conflagration",
      "Crownlight",
      "Recover",
      "Fortify",
      "Warp Staff",
      "Rescue Staff",
      "Sleep Staff",
      "Silence Staff",
      "Tomahawk",
      "Spear",
      "Gale Blade",
      "Thunderbrand",
      "Restore",
      "Witchfire",
      "Sunflare"
    ],
    "healing": [
      "Elixir",
      "Remedy"
    ],
    "statBooster": [
      "Energy Drop",
      "Spirit Dust",
      "Secret Book",
      "Speedwing",
      "Dracoshield",
      "Talisman",
      "Angelic Robe",
      "Swiftsoles"
    ],
    "promotion": [
      "Master Seal",
      "Infantry Seal",
      "Mounted Seal"
    ],
    "skillScroll": [
      "Astra Scroll",
      "Vantage Scroll",
      "Wrath Scroll",